title;image-src;link-href;date
Condor 4×4 – Ranpur Lapis Baja yang Jadi Bukti Heroisme Pasukan Malaysia dalam “Black Hawk Down”;https://www.indomiliter.com/wp-content/uploads/2023/12/3728560917-1-300x167.jpg;https://www.indomiliter.com/condor-4x4-ranpur-lapis-baja-yang-jadi-bukti-heroisme-pasukan-malaysia-dalam-black-hawk-down/;24/12/2023
Masuk Pasar Eropa, Rumania Jadi Pengguna Rudal Hanud Chiron Setelah Korea Selatan dan Indonesia;https://www.indomiliter.com/wp-content/uploads/2023/12/rk27yqrkgwq91-1-300x200.jpg;https://www.indomiliter.com/masuk-pasar-eropa-rumania-jadi-pengguna-rudal-hanud-chiron-setelah-korea-selatan-dan-indonesia/;23/12/2023
Hanwha Systems Kembangkan Sistem Deteksi Ranjau Laut dengan Kecerdasan Buatan dan Big Data;https://www.indomiliter.com/wp-content/uploads/2023/12/Hanwha_Systems_starts_development_of_mine_detection_system_using_AI__Big_Data-300x186.jpg;https://www.indomiliter.com/hanwha-systems-kembangkan-sistem-deteksi-ranjau-laut-dengan-kecerdasan-buatan-dan-big-data/;23/12/2023
Hai Lung Class (Taiwan) – Kapal Selam Diesel Listrik Modern Cita Rasa Belanda Penantang Kekuatan Laut Sang Naga;https://www.indomiliter.com/wp-content/uploads/2023/12/submarine_422-1-300x155.jpg;https://www.indomiliter.com/hai-lung-class-taiwan-kapal-selam-diesel-listrik-modern-cita-rasa-belanda-penantang-kekuatan-laut-sang-naga/;23/12/2023
Mimpi Buruk Pasukan Ukraina, Drone Kamikaze Rusia Bawa Roket Termobarik TBG-7V;https://www.indomiliter.com/wp-content/uploads/2023/12/Russia_equips_kamikaze_drones_with_TBG-7V_thermobaric_rocket_in_Ukraine_925_001-300x201.jpg;https://www.indomiliter.com/mimpi-buruk-pasukan-ukraina-drone-kamikaze-rusia-bawa-roket-termobarik-tbg-7v/;22/12/2023
Roshel Kanada Umumkan Pengiriman Rantis Lapis Baja Senator 4×4 Ke-1000 untuk Ukraina;https://www.indomiliter.com/wp-content/uploads/2023/12/412425104_10160794543118758_4007278500331741203_n-1536x1152-1-300x225.jpg;https://www.indomiliter.com/roshel-kanada-umumkan-pengiriman-rantis-lapis-baja-senator-4x4-ke-1000-untuk-ukraina/;22/12/2023
Tiga Awak Kapal Selam Taiwan Hilang Setelah Tersapu Gelombang Tinggi;https://www.indomiliter.com/wp-content/uploads/2023/12/sub-1-300x169.jpg;https://www.indomiliter.com/tiga-awak-kapal-selam-taiwan-hilang-setelah-tersapu-gelombang-tinggi/;22/12/2023
[Video] Pertempuran Jarak Dekat M2A2 Bradley vs BMP Rusia, Deteksi Awal Jadi Kunci Kemenangan;https://www.indomiliter.com/wp-content/uploads/2023/12/Fight_between_an_Ukrainian_M2A2_Bradley_and_a_Russian_BMP_near_Avdiivka_925_001-300x196.jpg;https://www.indomiliter.com/video-pertempuran-jarak-dekat-m2a2-bradley-vs-bmp-rusia-deteksi-awal-jadi-kunci-kemenangan/;22/12/2023
Pantau Kapal Penangkap Ikan dari Cina, Angkatan Laut Chili Kerahkan Kapal Selam Scorpene Class;https://www.indomiliter.com/wp-content/uploads/2023/12/GBaMlsFXwAAWRCp-1-300x169.jpg;https://www.indomiliter.com/pantau-kapal-penangkap-ikan-dari-cina-angkatan-laut-chili-kerahkan-kapal-selam-scorpene-class/;21/12/2023
Senat AS Beri Lampu Hijau ‘Penjualan’ Tiga Unit Kapal Selam Nuklir Virginia Class Block IV dan VII ke Australia;https://www.indomiliter.com/wp-content/uploads/2020/02/USS-Indiana_Commisioning_Navy-1_edit-300x200.jpg;https://www.indomiliter.com/senat-as-beri-lampu-hijau-penjualan-tiga-unit-kapal-selam-nuklir-virginia-class-block-iv-dan-vii-ke-australia/;21/12/2023
